{
  "schema": "chromofold.evidence-result.v1",
  "role": "candidate",
  "fingerprint": {
    "model": "Qwen2.5-0.5B",
    "runtime": "llama.cpp@example",
    "hardware": "NVIDIA RTX 2080 Ti",
    "workload": "context-32768-concurrency-1",
    "release_digest": "sha256:example-only"
  },
  "metrics": {
    "throughput_tokens_s": 44.1,
    "latency_p50_ms": 25.2,
    "latency_p95_ms": 33.0,
    "peak_vram_mib": 4920,
    "capacity_tokens": 65536,
    "correctness": true
  },
  "notes": "Synthetic contract fixture. Not a public benchmark claim."
}
